<?xml version="1.0" encoding="UTF-8" ?>
<palette weight="1" biome="plains" xmlns:xsi="http://www.w3.org/2001/XMLSchema-instance" xmlns="https://www.w3schools.com" xsi:schemaLocation="https://www.w3schools.com palette.xsd">
    <replace>
        <type>wall</type>
        <type>floor</type>
        <block id="quartz_block" />
    </replace>
    <replace>
        <type>pillar</type>
        <block id="quartz_pillar" />
    </replace>
    <replace>
        <type>rune</type>
        <type>path</type>
        <block id="chiseled_quartz_block" />
    </replace>
    <replace>
        <type>slab</type>
        <type>slab_wall</type>
        <block id="quartz_slab" />
    </replace>
    <replace>
        <type>stairs</type>
        <type>stairs_wall</type>
        <block id="quartz_stairs" />
    </replace>
    <replace>
        <type>gem</type>
        <collection>
            <block id="gold_block" />
            <block id="diamond_block" />
        </collection>
    </replace>
    <replace>
        <type>falling</type>
        <block id="white_concrete_powder" />
    </replace>
    <replace>
        <type>lamp</type>
        <block id="glowstone" />
    </replace>
</palette>